{"artifacts":[{"artifact_id":"native-extension","byte_count":2185336,"description":"Exact loaded _make_it_stand extension binary for this case.","media_type":"application/x-sharedlib","relative_path":"provenance/native_extension.bin","role":"native_extension","sha256":"4789455230377ec9909a81a41d507fb8f230b7ed53d14771d110fb5c4955adf3"},{"artifact_id":"diagnostics-r02","byte_count":11783,"media_type":"application/json","relative_path":"runs/r02/diagnostics.json","role":"diagnostics","sha256":"7548a87354d3e247483c6001a6c9bc67f10ab6564fe2f49087586dca151c4952"},{"artifact_id":"performance-r02","byte_count":599,"media_type":"application/json","relative_path":"runs/r02/performance.json","role":"performance_sidecar","sha256":"22eed681990b459661eced710cbf57a795af7491b935262fda6cd6e596ed1633"},{"artifact_id":"outer-r02","byte_count":522,"media_type":"model/obj","relative_path":"runs/r02/outer.obj","role":"result_mesh","sha256":"2f1f418762a7e5151a2d795e0379bbab4b1db61ceab98855b6af2bb348aad46a"},{"artifact_id":"printable-r02","byte_count":7084,"media_type":"model/stl","relative_path":"runs/r02/printable.stl","role":"manufacturing_mesh","sha256":"fbc6fe41b72951b6c6f1fd07cd3d6bb44856d291f41b6b3b0e1c4e9d3e00a3dd"}],"canonicalization":"utf8-json-sorted-keys-compact-v1","claim_level":"local_robustness","execution":{"build":{"build_type":"Release","commit_sha":"4b4303679bdca9091ca8ddcedd18095d5aec2de6","compiler":"GNU","compiler_version":"13.3.0","dirty_worktree":false,"flags":["-O3","-DNDEBUG"]},"hardware":{"cpu_model":"x86_64","logical_cpu_count":32,"machine":"x86_64","memory_bytes":64890535936,"os":"Linux 6.17.0-40-generic"},"timing":{"clock":"monotonic_performance_counter","phases":[{"name":"model_setup","seconds":0.0002526508178561926},{"name":"native_optimize_call","seconds":0.08684091595932841},{"name":"artifact_export","seconds":0.02198515087366104}],"scope":"model_setup_start-through_run_record_finalization","total_seconds":0.10996255278587341,"warmup_runs":1}},"experiment_id":"synthetic-carving-only-r16-h0","local_metrics":[{"name":"projected_target_energy","semantics":"Final projected balance-target energy reported by the R10 diagnostics.","source":"local_measurement","unit":"normalized_objective","value":1.4251881588465543e-32},{"name":"deformation_energy","semantics":"Final unscaled Laplacian shape energy reported by the R10 diagnostics.","source":"local_measurement","unit":"normalized_objective","value":4.160215566882174e-31},{"name":"normalized_rms_displacement","semantics":"RMS source-vertex displacement divided by the maximum source bounding-box extent.","source":"local_measurement","unit":"normalized_length","value":0.0},{"name":"normalized_maximum_displacement","semantics":"Maximum source-vertex displacement divided by the maximum source bounding-box extent.","source":"local_measurement","unit":"normalized_length","value":0.0},{"name":"maximum_handle_scale_deviation","semantics":"Maximum absolute deviation of a user-handle uniform scale from one.","source":"local_measurement","unit":"fraction","value":0.0},{"name":"committed_event_count","semantics":"Count of committed R10 geometry states, including the initial state.","source":"local_measurement","unit":"events","value":2.0},{"name":"carving_iteration_count","semantics":"Count of recorded carving iterations under the modern controller semantics.","source":"local_measurement","unit":"iterations","value":1.0},{"name":"deformation_iteration_count","semantics":"Count of recorded deformation line-search iterations.","source":"local_measurement","unit":"iterations","value":0.0},{"name":"algorithm_success","semantics":"One when the native result classifies the optimization outcome as successful.","source":"local_measurement","unit":"indicator","value":1.0},{"name":"targets_reached","semantics":"One when all declared final balance targets are reached.","source":"local_measurement","unit":"indicator","value":1.0},{"name":"manufacturing_ready","semantics":"One when the sealed manufacturing audit reports ready.","source":"local_measurement","unit":"indicator","value":1.0},{"name":"final_cavity_volume_fraction","semantics":"Final inward cavity volume divided by final outer-envelope volume; reported only for an empty or strictly valid inner boundary.","source":"local_measurement","unit":"fraction","value":0.02165768907680118},{"name":"material_mass_change_fraction","semantics":"Initial material mass minus final material mass, divided by initial material mass; deformation can make this value negative.","source":"local_measurement","unit":"fraction","value":0.02165768907680106},{"name":"measured_minimum_wall_clearance","semantics":"Minimum audited outer-to-inner clearance when a cavity exists and the audit completes.","source":"local_measurement","unit":"model_length","value":0.03333333333333255}],"manifest_sha256":"5e138251bf680d50c37d644c63746db1d17ee589733b709ba922b76df7e3cdce","notes":["native optimizer status: stable_after_carving"],"paper_reference_metrics":[],"repeat_index":2,"run_id":"synthetic-carving-only-r16-h0-r02","schema":"make-it-stand-r10-run-record-v1","schema_version":1,"seed":41002,"status":"succeeded"}